{"schema_version":"1.0","task_id":"task-2","revision":"r2","source":{"kind":"issue","ref":"https://example.invalid/issues/2"},"objective":"Validate contracts safely","repo_revision":"d2c0a5a","scope":{"allowed_paths":["src/app.py"],"forbidden_paths":["secrets"]},"acceptance":[{"id":"a1","description":"tests pass","grader_ref":"grader://contracts/test"}],"constraints":["No runtime"],"risk":{"level":"medium","reasons":["public contract"]},"approval_refs":["approval://review/2"],"extensions":{"note":"informative"}}
