{"schema_version":"1.0","task_id":"task-1","revision":"r1","source":{"kind":"issue","ref":"issue-1"},"objective":"Validate contracts","repo_revision":"d2c0a5a","scope":{"allowed_paths":["ai-development-framework/contracts"],"forbidden_paths":[".env"]},"acceptance":[{"id":"a1","description":"schema validates","grader_ref":"grader://contracts/v1"}],"constraints":[],"risk":{"level":"low","reasons":[]},"approval_refs":[]}
